Салат Цезарь 210 рублей;1;;;Борщ 130 рублей;1;;;Компот облепиховый 50 рублей;1
Салат Русский 190 рублей;3;;;Щи 100 рублей;2;;;Кофе 100 рублей;9
Салат с редисом и яблоком 100 рублей;4;;;Том ям 349 рублей;10;;;Чай зеленый 59 рублей;5
Сочный салат с капустой, морковью и яичными блинчиками 120 рублей;5;;;Сырный суп 130 рублей;10;;;Вода с газом 30 рублей;6
Салат с клубникой и помидорами 110 рублей;6;;;Финский рыбный суп с копченой семгой 150 рублей;10;;;Вода без газа 30 рублей;7
Легкий салат с редисом и фетакой 120 рублей;7;;;Молочный Суп 120 рублей;6;;;Сок яблочный 49 рублей;5
